{
  "$id": "https://github.com/b3axap/ai-brainstorm/blob/deploy/agents/_schema.json",
  "$schema": "http://json-schema.org/draft-07/schema#",
  "title": "Interpreter Agent",
  "description": "Schema for AI Brainstorm visualization agent configurations. Each JSON file in agents/ defines one visualization type.",
  "type": "object",
  "required": ["id", "name", "icon", "description", "keywords", "renderer", "systemPrompt", "outputExample"],
  "additionalProperties": false,
  "properties": {
    "id": { "type": "string", "pattern": "^[a-z_]+$", "description": "Unique agent identifier (lowercase + underscores)" },
    "name": { "type": "string", "description": "Display name shown in viz picker" },
    "icon": { "type": "string", "description": "Single emoji icon" },
    "description": { "type": "string", "description": "Short description for the picker UI" },
    "keywords": { "type": "array", "items": { "type": "string" }, "description": "Keywords Claude uses to suggest this agent" },
    "renderer": { "type": "string", "description": "Key in the renderers object (public/renderers.js)" },
    "systemPrompt": { "type": "string", "description": "Instructions for Claude. Must end with JSON schema to output." },
    "outputExample": { "type": "object", "description": "Example JSON output that Claude uses as reference" },
    "maxTokens": {
      "type": "integer",
      "minimum": 1000,
      "description": "Per-agent override for max_tokens (defaults to config.claude.generationMaxTokens). Use higher values for agents that generate complex HTML."
    },
    "externalAPI": {
      "description": "External API config (null for Claude-based agents)",
      "oneOf": [
        { "type": "null" },
        {
          "type": "object",
          "properties": {
            "provider": { "type": "string" },
            "endpoint": { "type": "string" },
            "envKey": { "type": "string" }
          }
        }
      ]
    }
  }
}
